{
  "schema_version": 1,
  "report_version": "1",
  "enzynotation_version": "0.1.0",
  "generated_at": "2026-01-02T03:04:05Z",
  "run": {
    "run_id": "fixture-run",
    "input": {"sha256": "aaaaaaaaaaaaaaaaaaaaaaaaaaaaaaaaaaaaaaaaaaaaaaaaaaaaaaaaaaaaaaaa"},
    "manifest": "manifest.json"
  },
  "integration_policy": {"id": "fixture-policy", "version": "1"},
  "run_summary": {
    "schema_version": 1,
    "total_queries": 0,
    "exact_annotations": 0,
    "partial_annotations": 0,
    "unresolved_queries": 0,
    "high_confidence": 0,
    "medium_confidence": 0,
    "low_confidence": 0,
    "unresolved_confidence": 0,
    "major_conflicts": 0,
    "minor_conflicts": 0,
    "provider_failures": 0,
    "provider_unavailable": 0
  },
  "provider_availability": [],
  "queries": [],
  "evidence_files": [],
  "provenance": {}
}
